"","Statement","topic","wordcount","charcount"
"1262"," I think one of the big problems for me, I don't know if anybody else thinks the same, but the money just gets thrown into this big pot and everybody just keeps scooping it out.  So you're saying where would the money come from, but it just gets thrown into this pot and it's crazy.  So we don't know how much each individual thing generates.  I mean obviously car tax generates masses amounts of money, but it's not all spent on cars and roads and road safety and stuff, it's just put into the pot.","Gender",96,503
"1263"," 12 talked about voluntary work, that people who have lived in Norway for a long time and know the Norwegian culture, but who also know the language of a minority group, could be a great resource through the Red Cross or other voluntary organizations. So instead of somebody just Here we come with our Norwegian language and you have to learn it Instead comes someone who has lived in Norway for many years and knows the culture, but at the same time knows the language and culture of the immigrant.","Immigration",91,504
"1264"," The problem about the pension and stuff like that is the fact you pay, you pay into it, the government take your National Insurance, they take your tax and then when were ready to, I want my money, the lump sum, its still taxed. I dont think stuff like that is really fair because I already contribute, I already paid into it, so dont tax everyone. The reason why Ive got that pension is for me to retire with that lump sum to have a healthy life. I dont want to be taxed.","Generations",95,504
"1265","  I mostly see it as something that goes back and is connected to these. There will be more problems for those who are non-retrained or those who will be un-retrainable. I think that the flexibility will be quite a burden for them. It is the group which  I know it's silly, but still  is at the bottom of this ladder, namely older, rigid people to put it simply and the group which is the most numerous. That is those over 25. Because how can someone who is not even trained be retrained, what into?","Labour market",97,504
"1266"," I would be in favor of conducting a study, preferably by the Ministry of Finance, and I would run the numbers with regard to all this bureaucratic apparatus, SGB2 people who work in addition, all the forms and application processes  what that all costs and calculate that against what it would cost with regard to electricity, training, work costslist that all out and compare those costs with just giving everyone this basic income money with no application process. I would like to see that study.","Econ. Inequality",87,505
"1267"," I think about the family and how it should be there for one another. A trend in the system is that people stay in their own home for as long as possible with supervision there. I have an aunt with dementia, but she lives alone. She has someone who looks after her every day then and makes sure she eats and things like that. It will save the society of costs compared to her staying in a nursery home or a sheltered house. It is beneficial if you could stay as long as it is possible in your own home.","Generations",101,505
"1268","With regard to property sales, if we were to reform the system so that we don't have to pay various charges but rather a tax on profits in connection with a sale, then that would remove an expense, right? In other words, we want to increase the amount of disposable income people have each month and we want to tax some of the income you get that you haven't had to work for. Income which you have purely because you got lucky. That could actually increase equality. At least in terms of disposable income.","Econ. Inequality",94,506
"1269","I also think we need to talk a bit about family reunification. I think that puts more of a financial strain on us than immigrants or refugees. Because when they come here and get a status in the country then they're granted family reunification for their father and mother who are elderly. The whole family ends up here, becoming a burden on society. They don't learn Danish, they stay at home on social security. And many are disabled. They come here and we give them equipment and I don't know what else.","Immigration",92,506
"1270"," Some of that money to increase  and youre going to give me the rest.","Econ. Inequality",92,507
"1271","I think that it should be a right and a duty to take parental leave. But what I wanted to know was; will this be less of a problem in the future, the way things are going? More women than men achieve a high level of education today. That could contribute to there being a difference with respect to wages for natural reasons. That it regulates itself. But we could support this development by saying that men have a duty to take paternity leave and that you have a statutory right to request to go part time.","Gender",97,508
"1272"," Based on my experience, I can say for instance in the basic welfare security rate, there are people in the group A10, which is a very high-level pay grade, they did exactly the same work as people with A7, and there are not just salary level differences between them, but that its the difference between middle and high paying wage classes where a university degree is the difference there. There might be different reasons for that. It may have to do with age, that this may affect salary for instance.","Labour market",91,508
"1273"," Well, but within the context of a training, whether thats in school or afterward in some kind of university study. That the practical aspect is brought in with the theoretical part of a training, for instance in school with larger and longer internship opportunities or something like that. But also in university study for instance. When a teacher studies for a long time and then after five or six years of study is then sent to a school and hasnt even had any real contact with children before that.","Labour market",90,508
"1274"," When I came to the country it was decided rather quickly. After a year it was decided that we could stay  residence permit. Then there is no wait. Then you begin Norwegian classes at once, get a job, attend school. The whole process was decided, and that is what it takes. I feel it is wrong to live in a country and not speak the language. It spreads to the next generation, which is even more wrong. People in other families who dont speak Norwegian, who are born here. I feel that is completely wrong.","Immigration",97,509
"1275"," For me, its also part of gender equality that the woman is not just reduced to mother, as this so often happens, that one immediately focuses on the role of mother. I find it a problem myself that I as a woman have to decide between being a woman and having a career. Its really difficult as a woman, which I like being, but to then wear a suit and then past a certain level of responsibility, its made difficult for me, because if Im still womanly, then many implications are brought along with that.","Gender",96,509
"1276"," Well  is that we are on about about companies earlier on and they play obviously.    If they want to sell products to us in this country and we use our own money, then they have to employ people from this country no matter what.  Up to a point but like you were on about the call centres in this country - if they could make something and they are trying to sell it to us, they have to use people in this country rather than keep going abroad all the while, so that more people can be...","Econ. Inequality",100,510
"1277"," We were encouraged to pay attention to the media and the papers since last time, and then I discovered an important topic within the vocational areas you describe, and it is really mafia business: Big, black economies are taking over all regions of work, vocational sources and tenders and tasks you find publicly and private. I would recommend the politicians to focus on fighting the mafia in the working life, so that more young people could get a job and also that the tax income could benefit society.","Econ. Inequality",89,510
"1278","I don't know if it's relevant, but I think that Sweden has got it right in terms of the flexible labour market where all those who have children under the age of 8 are entitled, not obligated, to work part-time. And that applies to both men and women. Denmark is the country with the largest number of childcare institutions. I question whether these institutions are the best way for a child to grow up. We should invest in families. They pay into a parental fund, so in that sense it's funded by the parents.","Gender",94,510
"1279","  Why not? Same thing, a woman will decide if she wants to stay at home, or she and her partner will decide whether she will stay at home and raise the children or go to work. It's still equality to me, it's she who decides. Abroad too, there are women who work, when they could stay at home. My partner for example said, I don't know how much you can earn, I would still prefer to go to work. Because I cannot stay at home. Truly. But most of all, same work, same pay. This is the starting point of it all.","Gender",103,510
"1280","That's redistribution. On this note about robots and things like that. We see how much progress they offer. I saw a programme on TV the other day about South Jutland hospitals. There was a robot that was used to fetch chemotherapy drugs. It was called Ejner. It had freed up time for the nurses because they no longer had to go down to get the chemo drugs and then back up again. So that's a really good development because it allows people to do other things. Like one nurse said: ""now I have more time to...""","Generations",91,510
"1281","We must work to ensure that the health service is still capable of supporting the elderly, but I think we need to look at situations where people won't get old-age pension. We should consider saying to those who have saved up a lot that they won't get the old-age pension at all, and maybe even remove it entirely in the future. I believe that it should be means-tested, that's where we can save. Of course it's unfair to have to save up all your life and then get nothing from the state, but that's how it goes.","Generations",97,512
"1282","  The economy could spin, but a cut will have to be made, drastic measures adopted, perhaps also in the area, please don't be offended, I don't want to repeat myself, of unemployment. Each young unemployed person - alright, everything is limited, and most of them get 3 months, or even less, but they are all thinking, why should I take this job for a minimum wage? If they can stay at home, work illegally, maybe do a job waiting tables once or twice, and get paid a total of equivalent of the minimum wage.","Labour market",95,512
"1283"," Im surviving but I can see myself also racking up the debt long term because okay, I pay the mortgage, pay everything we need to do to run the household.  The kids theyre bought everything  one day I feel like maybe Im going to say, no, I cant do this no more.  So Im trying because Im thinking one day the government are going to look and do a U-turn and Im going to be like, yes, this is what I was working towards but how long can I do that for?","Econ. Inequality",101,513
"1284"," There are a few reasons for that, not that Im supporting it, but with regard to male and female workers, it has to do with instances of illness or health issues coming up more often with women, and planning security is weaker with women, because they may have a child. Not that this should lead to them getting less, but the arguments about why they receive less are that sick day counts are higher, etc. I dont think that women work less efficiently than men, rather the opposite. But those are the reasons.","Gender",94,514
"1285"," Its also important to create this equality, and sometimes it lags a bit. You could put concepts or examples out there for instance for men who want to take parental or childrearing leave instead of the woman. That you put forward a concept with men as positive examples of this and not as negative, saying theyre a sissy for staying home and cooking and cleaning or what have you. We should bring this more to the foreground. Again, maybe using a marketing agency to show this is good and how it can be done.","Gender",95,514
"1286","I actually really liked that stuff that was said about pensions. I had a slightly different proposal with regard to that, and that was that a married couple could have a shared pension account. Then if you were divorced at the age of 50 it would split into two parts. That would allow us to get around this issue of one person getting a bad pension and think that could be great because it wouldn't cost society a lot of money. It would be the same. It would only apply to pensions and not to all forms of savings.","Gender",99,514
"1287","  The young. If the state was to increase the minimum wage, so that it would be co-funding payments to workers, regardless of, let's leave the forms of employment alone, or taxation, or subventions, anything  more people would be looking for jobs, there would be less people registered as unemployed, less money would be spent paying the transfers and people would spend more, and more tax would be collected from the citizens and things would be turning around. But yes, a drastic change would have to be made.","Labour market",89,515
"1288","  I mean we like to compare ourselves to others so much and look up to our northern neighbours and western neighbours, lets say the Austrians and the Swiss. Austrians have just changed, I mean as of next year, their tax legislation and reintroduced 5 brackets. I think that they previously had 4. Now they are going to have 5, just as many as we used to have. And the brackets the majority of population falls in, I think it's the second bracket, the second bracket will hardly have to pay any tax in Austria. So","Econ. Inequality",96,517
"1289","Yes, but I feel that there are two ways of acting in a civil society. A professional way and a cultural way in the immediate sense...My wife is from Portugal. It's a Western country, but I certainly notice the difference in terms of how some Danes live their lives because I've had the privilege of having a foreign wife. How do we make it acceptable? My wife has been here for five years and she doesn't feel welcome. She experiences racism. People talk more slowly and more clearly to her. She speaks fluent Danish.","Immigration",94,517
"1290"," My mind is blank, but thinking about immigrant women, like my mother. She came  to the country for 30 years ago and then she worked for a cleaning service called ISS. She didnt go to any Norwegian class, and she learned the language at work. She is fluent in Norwegian today. Had she only stayed at home and my dad was working, our financial condition would have been bad. Then only one person has an income, she wouldnt have learnt the language. That is integration. Better financial conditions for the family.","Gender",92,517
"1291","  And another thing, if I may add, when were talking about education. Now in this Bologna system, everything is so set in stone... you dont pass an exam or two and you have to wait for a year, taking a break or repeating the classes, and then this period is somehow  . We should allow that if youre two, three classes short, that you can move on with your education and complete it as soon as possible. This is a hindrance. Just because of one exam, for which they ran out of time, they cant complete the year.","Labour market",100,518
"1292","I'm the sole provider in my household. I earn more now than I did five years ago. But the costs have increased since then. And as soon as your earnings exceed the limit that is set to determine whether or not you're eligible for housing benefit, then you're out of the housing support system. Then you need to pay the rent yourself even if you are the sole provider. There should be exceptions. Even though I earn better than I did in the past I can't afford to buy a car to make life easier for myself and my two kids.","Econ. Inequality",101,519
"1293"," For immigration this is quite strict they go through various assessments, they need to provide various documentation.  I think the biggest issue is actually with the EU nationals because there is no limits, no control or nothing.  They can just come and do whatever they want to so maybe just put more focus on the actual EU nationals, check who is working, whos not working, how long have they been unemployed, whether they are actually coming here for work or whatever theyre coming .","Immigration",87,519
"1294","I work in a female-dominated worldschoolsand it drives me nuts the way they make decisions. The decisions are sensible but I don't feel that I'm treated equally in that women's world. I'm with Leif in that more girls going to high school means that we'll have a situation in the labour market where we'll need to rethink our social model with regard to men's duty and right to take parental leave in order to legitimise it. Equality will be qualified differently in 2040 because men won't be as well-educated anymore.","Gender",90,519
"1295"," I think poverty is an issue  because people who sit on their butts dont want to educate themselves","Econ. Inequality",98,520
"1296"," We do have restrictions with for example work assessment allowance. Very specific though. But I think we should make more restrictions for the immigrants too. More than today. Maybe work assessment allowance is a bad example, but request that they go to Norwegian classes for example. The first thing you encounter when you come here is how things are, and if you arent prepared in any way, it is of little help that you get money to get started, when you have no idea of how society works to make use of those means.","Immigration",95,521
"1297","I very much agree with many of these things, but I still think that if I had to pick one issue it would be immigration. We need to tighten that up now, right now, as in we should have done it yesterday. There goes 3/4, 3/4 of all refugees are immigrants just jumping on the bandwagon. As a refugee you shouldn't...just because someone in your family has managed to get here, they don't automatically get to bring their entire family. And if they do then they need to be able to support them for a certain number of years.","Immigration",99,521
"1298","I would like there to be a change in the tax system so that people's incomes were taken into account. That we put limits on income saying that from this amount to that amount should be taxed this much, etc. So that what you pay in tax is manageable, so that you have enough money left for yourself after tax. Otherwise there will be greater inequality... If you earn 100,000 per month and pay the highest tax rate you still have more money left for yourself than those who earn far less and don't pay the highest tax rate.","Econ. Inequality",99,522
"1299","With regard to state expenditure it's one of the biggest items. I suggest that we remove the old-age pension, elderly benefit, domestic assistance. What we're left with is the basic service known as the nursing home. In other words, if you've saved up then you have the option to purchase domestic assistance services. That way you exhaust your own resources first. Once you've spent it all; because you'll live to be 120, then you're welcome to move to an elderly people's community where your needs will be looked after.","Generations",89,522
"1300","On the other hand it's also reasonable that those who have saved up will have more than those who haven't... I'm obligated to pay into a retirement scheme through my work. I look at it a bit like a hidden tax because I'll have to live to 92 if I'm going to enjoy all the money I've paid in. I'll get it back in instalments. I can't select a different format because I'm employed by the state. Why isn't that part of the tax on old-age pension instead? Why is it part of my pension scheme? I see it as an additional 16% tax.","Generations",104,523
"1301","Something we could do in practical terms...one of the better measures I've encountered in recent years is the Danish and World Tradesman Championships. That could be extended to many different industries, organised by the state. In Japan it doesn't matter what you do, there they take pride in their job and they're really good at it, regardless of whether it's packing tuna or pushing you into the subway car. That's cool. A Danish Skills Championship would be really good because it would make us think like the Japanese.","Labour market",88,523
"1302","  In the long run let's say the majority of those, if the only ones that stay are older ones or lower paid profiles of workers - and the state is losing as well, it is losing, I can't call it its own relevance, but its, it culture, its potential for development, for progress. If the state is only importing high profile professionals, and the pensioners are the only ones to stay in the country, the children and those working in let's say factories, such a country is unable to progress in the long run, because it will","Immigration",98,525
"1303"," But with that, for any of those people, comes child care.  I got made redundant, I then stopped my son going to the afterschool club, because even though he loved it and he didn't want to stop going, (a) I could now pick him up, and (b) I couldn't afford to keep paying for it. If you're gonna send somebody on work experience, who's gonna look after their kids, that they've had to pull out of nursery because they can't afford to pay for it 'cause they haven't got a job.  It's, I think, doing it one way, it kind of...","Labour market",102,525
"1304"," I believe the situation is versatile, but the bit I have seen of people who have tried this, is that it isnt sustainable. Even if you have managed to establish it, you cant run it. People dont need a hundred curiosity shops or whatever. But we need services. Healthcare like we mentioned. This is a matter close to my heart when we talk about refugees and language. The demand for the language teaching is infinitely huge. Not the high-flown language teaching, but the first step. Why not make a mobile language school?","Labour market",93,526
"1305"," In the Nederlands I believe it was 1000 Euro a month. In India it was less. You were given a sum to live by without any restrictions to it, everyone got it. This resulted in some extended effects that amazed people, positively. Some people didnt do shit. They hadnt done before and they continued doing nothing. A few of the ones who received this had been involved in voluntary work. They couldnt get an ordinary job, but they contributed a great deal to society without getting paid for it. Now they were paid for it.","Labour market",96,526
"1306"," On TV, there was a report where several young people explained how they fled their country, maybe in a high school class or something, and they told about what the women and girls had to go through on the way to Germany, and afterward they asked the class what they thought, and there was a significant effect on them having heard personal experiences directly from those affected, what really happened, and even the people who were quite skeptical were quite convinced that this is the right way to go. Its very difficult.","Immigration",93,528
"1307","That's how we fund compensation for occupational injuries, for example. But I think that we need to prioritise the example of male educators because there's a definitive example of inequality. When people think like that then there's no equality. If you say ""men are not necessarily paedophiles"" and repeat it enough times then it becomes ""men are not paedophiles."" It sucks, but just because I hear that someone's run a woman over that doesn't mean that every time I see a car I'm going to think that it's going to run me over.","Gender",86,528
"1308"," I dont think Im abusing my power, as a train driver that  to sit there and press a few buttons and the union, they hold Virgin to ransom basically with terms and conditions that in the end theyre just going to try and keep that, and there will be poor people on less money who opt out of the union and that will be a terms and conditions in their contract that they cant join the RNT. So it can work if the unions fair, I think, but it does give people rights and you have kind of got some support.","Labour market",104,528
"1309"," I have thought about something, bit of a touchy topic: How long before the next of kin have to care for their old relatives? In many countries, there is of coursewhen you dont have the same public systems the family has to be there, but if the country actually gets a more squeezed economy ahead, one has to demand more of the next of kin perhaps. Then again, you have the ones who dont have children and the ones with children living far away. A difficult topic, but I think it is relevant to discuss it at least..06:10?","Generations",99,529
"1310","  I think that wed have to, those that are also letting workers go...what the companies are doing is employing the workers for a couple of months, so that they receive the state contributions, pocket the stimulations, then they let you go quickly, but its precisely these companies that are letting go of workers quickly, that wed have to put pressure on. In the long run, so that they wouldnt be doing that. If they let you go, they shouldnt be able to hire the same number of workers the next year and again let them go.","Labour market",97,530
