"","Statement","topic","wordcount","charcount"
"556"," Im thinking that when someone talks about welfare, they talk about money. How to link immigration to money? Rather than immigration being a cost and looking at asylum seekers as someone who only take our tax money, to actually turn it around and make it into something positive, economically.","Immigration",50,297
"557"," Registry and application. Were not really getting a handle on that either, and we have the problem that many people are here and are unregistered or are too afraid to register, and Germany needs to know what people are here staying in the country. So that would be a concrete measure to take.","Immigration",54,297
"558"," But you need these people as well because at the moment everybody out there is going for the finance sector so in 2040 we will not have qualified plumbers, we will not have qualified electricians, well just have a few people who are going to do it and theyre going to overcharge us, really.","Labour market",55,297
"559"," Education often leads to jobs, and a job often leads to an income and perhaps less inequalities. Maybe it will even things out wage-wise. That we dont get many low paid jobs. And that it could make it more lucrative to work in healthcare for example. Skills development in all the occupations.","Econ. Inequality",53,298
"560"," Not based on appearance and gender, but rather the person registers with a number and only the number is seen by the company, and at a later point in time, after the person has met the preconditions and requirements, then they come to an interview where the personnel actually appear in person.","Econ. Inequality",53,298
"561","I don't agree at all. People are individuals and not just one part of a marriage. We need to share but there needs to be reasonable limits. Just because you've lived together for a while, and you might not have children, you shouldn't be forced to share your pension if your pension is much bigger.","Gender",55,298
"562","  And in general, there would be more occupations available for everyone. Because men may decide for certain occupations, women on the other hand never even dream of doing certain occupations, however with this measure, both would have more occupations available, all occupations, in this sense.","Gender",46,298
"563","  That's right. Because, you see, if the, the compensations for unemployment are linked to it, it is just an extension, which would be, if one was receiving less and for a shorter period, during working age, that would be it. Then one knows exactly if it is profitable to extend the working age.","Generations",54,298
"564","  What I am saying is that I personally refer to what I think - if I work for a good company which pays good wages, I don't care how much my boss earns, how much the director earns, nor his secretary, as long as I am being paid enough money and am happy with my pay check, it's as simple as that.","Econ. Inequality",63,299
"565"," Especially with all the foreign investment that we've currently got in the in the UK with companies like Jaguar Landrover, they are owned by Indian companies, are they then just going to turn round and say, well, do you know, we will take our business elsewhere so you might have a mass closure.","Immigration",54,299
"566"," Wait a minute though, they are getting benefits. Im just talking about how to achieve this. How do I get them to take part in a language course? Id have to ask if you have a better idea. What else can you do other than say, if you cant speak the language, then you cant get certain benefits?","Immigration",59,299
"567","  There could be, if the state finances a person long enough, as it does with young researchers, giving them money, but he or she should, should then absolutely stay in Slovenia and work here for a certain number of years. But the state needs to provide the possibility for his or her employment.","Immigration",54,299
"568","You're the one who mentioned pensions and part-time work and taking care of children. I could imagine that, considering the falling birth rate, we let women keep their pensions while they have young children in order to compensate them. That could get the birth rate up and give people an incentive.","Gender",51,299
"569","  Offering benefits so that the state will offer or encourage certain benefits... how should I put this. Certain benefits, perhaps in the field of tax policy, so that the people would see that its worth coming to our country, investing your capital, and by doing so, theyd employ the domestic...","Immigration",51,300
"570","  Well, basically, our citizens would be working, there wouldnt be any unemployed. Because if ours were unemployed due to too many foreigners, youd need to give them social benefits and all, public expenditure would be greater because thered be too many unemployed citizens of the host country.","Immigration",48,300
"571"," Maybe, maybe not. But the question is: Do we need the same number of men and women as nurses, or should nurses be paid more? It is a profession dominated by women. Do men and women have to do exactly the same at work? Cant there be differences? But then it is more about the total wages, though.","Gender",59,300
"572"," I think a flexible retirement rule would be good. That means if I still want to work, I want to be able to do it without pension disadvantage, but then I offer my experience. That doesnt mean this is possible in all professions. Therefore it should be flexible and according to ones own wishes.","Generations",55,300
"573"," Youd have all the data from the retirement pension office, but youd need an overarching agency, because youd need to include the self-employed people. Youd need an agency that would cover everyone in order to prevent double payment or fraud and the like. I suppose we have the tax ID numbers.","Generations",52,300
"574"," Im just thinking off the top of my head, but if they are paying the normal contributions for pension, unemployment and healthcare insurance, then in this transition phase, there must there must be a progressively calculated public reserve fund for these people for purposes of this system change","Generations",49,300
"575","  My grandmother used to say to me that thats the only thing keeping her going, because shes curious what will be with her grandchildren, what will happen, when will he get a girlfriend. And its their descendants who keep them going, whats up with them, when someones birthday is coming up...","Generations",52,300
"576"," Elimination of limited-time work contracts and positions. Its often the practice to hire people on three-month contracts or for a half year, and then you can never plan in your life. Some people are caught in this kind of track for 20 years, and people are afraid to have this limited situation.","Labour market",53,300
"577"," You are reporting your tax payments like that, rather than taking a year to report all your figures, your figures get sent to the HMRC like every week if you are weekly pay, or every month if you are monthly pay.    You always know, you are always on top of what you should be generating in taxes.","Econ. Inequality",58,301
"578"," Macro-economically it will pay to make an extra effort and become a little richer for the whole of society to create more jobs. Hence more people who work. Rather focus on everyone having an equal start, that you are paid equally later in relation to what effort you have put down in working life.","Econ. Inequality",55,301
"579"," I think many people with different incomes who can hardly get by, like salespeople or normal people, whoever, they have a hard time with this idea that managers or high level administrators get paid millions compared to the sales assistant who gets paid nothing. Many people see this as a problem.","Econ. Inequality",52,301
"580"," There are all these voluntary initiatives, and there are a lot of really competent people who also have the necessary motivation to do this. I could provide more financial support for those efforts so that that they get an initial boost at least. But then we have to talk again about sensitivities","Immigration",53,301
"581"," I want to have children  so I'm having to look at that, and it's making me put it off longer.","Gender",61,301
"582"," I also thought about equal wage on standard man or woman. If they have the same position, it should be equal. Better adjusted workplace in respect of Women dont apply for management positions. Maybe it is difficult to combine with children. Maybe they cant work 10 hour days with a baby at home.","Gender",54,301
"583","There are more women in high school now than in the past. But I think the situation is different in the labour market because women are afraid to apply for top jobs because they are male-dominated, and they're fearful of not being taken seriously. And men are afraid to apply for care jobs, because...","Gender",54,301
"584"," We could also discuss these Christian holidays. We have a ton of holidays where people just wash their cars and so forth.  We used to have day of repentance and reflection, etc. In England they dont have a first and second day of Christmas holiday, or Good Friday. They think were nuts.","Generations",54,302
"585"," And pensions could be higher for most people. Those with full income pensions under the old system would likely get less, because that couldnt be supported, but normal retirees who all paid in, they would likely get more. The generational contract would be supported, because the coffers are full.","Generations",50,302
"586","  Isnt this meant in a way that if theres no work, if a certain programme is suspended, that the employees are put to the side and employed elsewhere and you again have some form of work, when someone is satisfied with a certain person. They can already dismiss them now, if they are dissatisfied.","Labour market",55,302
"587","About protecting care workers. How could you formulate that to make it the welfare state's job? That the welfare state's ability to create economic growth hinges on the elderly and children being looked after? It's not particularly well-paid today, but could it be managed differently in terms of wages?","Econ. Inequality",49,303
"588","  They advance in categories. It is possible to advance in our system too, but the promotion is only reflected in 3 extra EURO per month, I'm speaking suma sumarum, one advances due to longer years of service, for example. And we have personal evaluation. Your superior evaluates your work and so on.","Econ. Inequality",53,303
"589"," What youre saying is correct, but if you talk to people and tell them there is no threat, that is not right either. In dangerous situations, you have to be honest about the danger, but do so in a way that does not create panic, so that the radicalization of the right wing in Germany does not grow.","Immigration",59,303
"590"," With regard to measures, this is a harsh example, but where the brother and his cousin killed that person, because she was involved with a Christian. So they executed this person in the name of their familys honor and then left the country back to Turkey or whatever, because that is allowed there.","Immigration",54,303
"591","It is a left-over from the old days when the man was the breadwinner and the woman went to work to make money to buy new dresses and handbags. Back then her earnings weren't as important to the family budget as the man's, and now that's simply changed. We work for just as long and we work just as much.","Gender",60,303
"592"," Thats putting it a bit simply, but at the moment its completely impossible for the current generation to pay for the costs of this 1 to 2 ratio while at the same time trying to save something for themselves so that they have something to live off of when theyre retired. This has to be supported.","Generations",57,303
"593"," The way it works today with sickness allowance The sickness allowance today is 6G (six times the basic amount. The basic amount is ca 90<a0>000NOK). It is the employer who pays you, but the employer gets the money returned. If you earn more than 6G you only get 100 percent up to 6G. If you earn over","Labour market",58,303
"594"," I believe it has already been said, but to have better terms for employers. In general, I guess. Less employers contribution, lower pay settlements in the years to come. Opportunity to employ people on short-term basis more easily. It turned out to be many things, kind of. I believe it is covered.","Labour market",53,303
"595"," The labour market is made up of both job seekers and jobs, one can work in two fields. We have talked about the jobseekers education. I believe the most important thing is to create new jobs. Then we are back at where we were last time with innovation, research, development and that type of thing.","Labour market",56,303
"596","Something completely different: Labour mobility. I think that's very relevant to all of this. At the moment a job only has to be 30 km away for it to be possible for a person to turn it down. And with the transport opportunities we have today we could definitely draw up different limits in that regard.","Labour market",56,303
"597"," At 14 you could choose to do a term in plumbing, you could choose a term in bricklayer, so that pathway is, theyve got that choice at the end of that two years, and theyre gaining a qualification from it.  But, that wouldnt be delivered by the school that would be delivered by the private sector.","Econ. Inequality",57,304
"598"," Thats probably a good thing then that more schools need to do that to bring up the schools from inner city and more deprived areas so they can do as well.  Maybe they do need extra help because they havent got the same influence at home, dads a lawyer, mums a doctor, to push them so maybe that","Econ. Inequality",59,304
"599","  This is just to gain political points and nothing else. Because if you see how many there are at the very top and those at the very bottom, who won't be able to pay at all, you'll see that the result is the same or barely minimum. For the economy as a whole, for the money. So we'll get out of this","Econ. Inequality",63,304
"600"," The skills don't bring in...I mean Germany now are willing to take a million, no I think it's one and half million Syrian refugees and their thinking behind that is they have an ageing population and the birth rate has dropped and they are identifying that now.  They are saying we need these people.","Immigration",55,304
"601"," Im thinking about Heinz Buschkowsky and his book again where he talks about parallel societies that arise out of this. This is also relevant to integration, and if you have these parallel societies, then this is a failure of integration. Those situations shouldnt develop out of normal integration.","Immigration",49,304
"602"," For those type of refugees. For economic refugees it might be different, but for this kind of thing, were glad to take them on, because wed like to be helped out if we were in this situation, but you could differentiate and look to see if the situation has changed and if the majority could return.","Immigration",57,304
"603"," Thank you, this information here, it's saying it's about how much money earned, it doesnt state in here if they're doing the same job.  So, if you're taking this information that they're doing the same job, because this just says that do men and women earn similar salaries?  Is this in the same job?","Gender",55,304
"604","  Well, perhaps we could determine a certain number of employees, over 1000 employees and the company needs to take care of this, or I dont know, Ive made this one up, right. A certain number of employees or the number of children in that generation of employees. We should limit this with a number.","Gender",55,304
"605","  At the same time making dismissal easier. Because of that, the person that feels safe works a bit differently than the person whos under stress all the time. And if they let it all go, they dont work as productively and you see that this person isnt right and you have the chance to dismiss them.","Labour market",57,304
"606"," I know, but companies would though, we are on about companies that they are answering to us, everything that a company does is recorded goes to the tax people  they can't get away with it.    You might think they can but they can't, so they have to go through the taxes, all the information is there.","Econ. Inequality",58,305
"607","If we started somewhere, just like the Swedes have done, and stripped everything behind it back. The Swedes did it a few years ago and got a simpler tax system. It would make it easier and more attractive to finance our bottom line...to make sure that the average citizen doesn't have to go to bed hungry.","Econ. Inequality",56,305
"608"," The more people you have in the country, they need to eat.  They need to havethey need clothes.  They need education of course and they will need somewhere to live therefore will that not benefit the building trade, the food suppliers whatever, all that.  They create a need for more of all of that.","Immigration",55,305
"609"," Economical argument: The father normally earns more than the mother. So if it could be done in such a way that the parental leave is from whoever earns the most, then Im happy to split. Then I believe it would be easier for most couples to say Fine. Daddy stays home Because the income is the same.","Gender",58,305
"610"," Very few people are benefitting, but the majority are suffering because of this.    In this policy thing we are talking about something needs to change there where private companies and corporations are in line with what the public, you know, their standards of living and what their needs are as well.","Econ. Inequality",52,306
"611"," No, but why youre capping it?  Youre capping it to .  Youve got to find a way to, its turning a wheel around.  So its like us sitting there and not moving.  Its moving so 5,000 people who dont do anything.","Immigration",56,306
"612","  It should be a priority for this person to stay here. Such a person is obviously already integrated, so there are no costs there, he or she is from here, at the end of the day, even if he or she is one of the 12 %, who are from other countries, but most of these are already Slovenians, so to say. So","Immigration",64,306
"613"," There must also be a rule for those who have higher pension entitlement so that they get some kind of balancing compensation when the unconditional basic income is put into effect. There would have to be a double-financing of this for several decades. As with everything, thered be winners and losers.","Generations",52,306
"614","I can understand why the retirement age has been pushed back. And I don't think there are many in my generation who believe they'll get an old-age pension when the time comes. My opinion is that we should make some cuts, in case anyone had any doubt about it or who was counting on getting a state pension.","Generations",58,306
"615"," As you say, we have the Princes Trust over the years, and we need to have more grants like the Princes Trust, not just the Princes Trust so we can help the young people, we need more creative brands like the Princes Trust because thats almost like the ways that British value, the Princes Trust.","Labour market",56,306
"616"," I have a question with regard to the goal. Are we talking about the same work, meaning in the same sector, or are we talking about the same effort? I mean, a cleaning lady for instance does physical labor, and a manager or something like that works more mentally and physically to some extent too, but","Labour market",57,306
"617"," But if you had the potential to take fagbrev (certificate of completed apprenticeship) They say, it has been in the media, that many people apply for part-time jobs Tom got the job out of 3000 applicants If there had been more vocational workers, there hadnt been so many applying for that position.","Econ. Inequality",53,307
"618","  It's not such a problem, I mean, why is there a lack of doctors and such? Because it is difficult for those who finish medical school to acquire the specialisation and acquire everything, to acquire the license before they can start working in the first place. That is also the reason for the shortage","Immigration",55,307
"619","That's what we're saying, as long as it's not mandatory but a right. Not an option, not mandatory, but a right. When my mother was pregnant she was told that she was allowed to drink as long as she didn't get drunk, and she did. Things change and research is published and we need to take that into account.","Gender",59,307
"620"," I agree with , in that it's not mandatory for everybody. Those who are not in fulltimeyeah, under the age 21, if you're not in fulltime education, you're not working, you're not in an apprenticeship, you're not in fulltime training, you will be doing some sort of community / military service.","Labour market",52,307
"621"," I thought about including more people in the working life. I mean, the first definition should rather be what the minimum unemployment in the country should be. Cant have zero unemployment. That wont work, then things wont move forward. So first we need to find out what the acceptable minimum is at.","Labour market",53,307
"622"," Maybe not directly the state, but if its possible, last time in discussion we talked about having flexible work times in those jobs where its possible, so that one could better combine work with family. That you can work your schedule around your family without the state necessarily getting involved.","Labour market",51,307
"623","  Particularly for occasional jobs or short-term  I mean, OK, all of them, I think that in lots of cases these kind of things don't even kick off, because taxation is so high, and perhaps with smaller jobs there should be lower taxation and not for all the jobs to be subject to the same high taxation..","Labour market",58,307
"624","  So in education, that you already start gaining knowledge, that youre already on the labour market, that what you work, contribute to the employer, already counts towards your period of employment and the employer can engage you for future work. So, the first step is already when youre in education.","Labour market",51,307
"625"," To do with background and situation. I meant more in respect of qualifications. Many want to, regardless of gender, to pay more for a better background to contribute with more in the position later, more than for just that position exactly. One of many things that help to make a decision in that matter.","Gender",55,308
"626"," This has to do with What I think here One has to be able to control, to divide the days of leave between the mother and the father to a larger degree than what is possible today. To take it to the extreme: She is very likely to have children, but potentially the father could take all the days of leave.","Gender",62,308
"627"," And if they take our suggestions up, about limiting the amount of people coming in.  Otherwise, there are going to be a lot more people out of work, because you've got foreign people coming in, who have got nothing to offer, and they can't speak the language. And they're gonna go straight onto the dole.","Labour market",56,308
"628"," Well, if it's benefits you should work for your benefits. Why shouldn't you? Because at the end of the day why should you be getting, what is it, <a3>80 a week and your rent paid and all that lot, and the people working hard they can't even I think you should be doing community service or doing something","Labour market",59,308
"629"," I would think this is a problem for the employer, because you have shorter periods of time because of these limited contracts, and what if you want to take on larger or longer running projects? Will the employee stay there? Do I have to find and train someone new after a half year? That also costs time.","Labour market",58,308
"630"," Yes, I think you shouldnt get rid of that.  I think that tax amount being added, to have that little bit we dont get taxed is an incentive to actually go to work because you think, Im earning that money before I get taxed and to take that off people I think will just cause people to not want to work.","Econ. Inequality",62,309
"631"," I remember back in the seventies when we had much unemployment. The Norwegians were pissed because the foreigners, especially the Pakistanis, came and took the jobs from the Norwegians. They scrubbed pans and pots and stuff in the kitchen. Before the unemployment Norwegians wouldnt do that type of jobs.","Immigration",50,309
"632","  Exactly, what a stupid question. The state must enable the economy to prosper. And not the public administration. While the situation in Slovenia is quite the opposite, the state is repressing the real economy, while everything else is expanding. And this can't be who is to employ an expert? The state?","Immigration",52,309
"633","  I mean, all due respect to foreigners.  if I am to travel to a Muslim country, I won't be allowed to wear a tank top with straps, perhaps I will have to, I won't be allowed to wear trousers, I'll have to wear a dress and I will adjust to their environment. Why is this not the case the other way around?","Immigration",64,309
"634"," So, are we're saying that what we want to see out of this is that the cost of childcare comes down a bit, so that women can continue to pursue their careers instead of being like the only option is to give up work or become a dinner lady, because it's the only thing you can fit in between nine till three?","Gender",63,309
