"","Statement","topic","wordcount","charcount"
"984","  I personally, given that thats already being carried out even though many people dont know yet, the elderly can work up to 60 hours per month or earn somewhere around EUR 6,000 gross a year, that means there can be solidarity, assistance. For instance, employ the young people, while the elderly person can work those 60 hours per month and contribute to this...do you know what I mean?","Generations",69,393
"985"," I dont think this is so clear. In some cultures, its the case that men can do anything, and women are allowed nothing. This has to be addressed, because even in German-speaking countries, there are situations where men suppress women and say they have to stay home and do the housework, and the man goes out to earn money. That happens all over, but more prominently in foreign countries.","Gender",70,394
"986","  No, no, this is mixing apples and pears. One thing is, what we were saying about pensions paid by the state. The other thing is additional pension insurance, which some are paying into pillar pension schemes, or make savings, investment savings, or something  it's something those with high income are able to afford. And they will have more to draw from. But someone who was in a lower.","Generations",70,394
"987","  And all the residents of the island receive a payment from the government, because they pump so much gas. And I think that about 60 % of islanders are alcoholics, and soon. Because they do not have to do anything, don't have to go to university, why, they receive quite a large monthly some, let's say 1.000 EURO a month, but yes  this should be limited to 600 EURO, or let's say 300 EURO.","Econ. Inequality",76,395
"988","Regarding the burden of an aging population. How many people actually use that expression in all seriousness? I think it's a daft and negative way of talking about the issue. None of us think of it as the burden of an aging population. Only that it represents a greater expense. But that's not because it's a burden as such. We should actively say that we have agreed not to use that expression.","Generations",72,395
"989"," They have got more money than sense half of these, you take Barclays Bank for instance and you've got your cashiers, well I know they are dwindling them down at the moment, but I know for a fact that every Christmas those cashiers they don't have to hit a target or anything, but they get a <a3>3,000 or <a3>4,000 bonus at Christmas - every single one of them  every cashier who works at Barclays.","Econ. Inequality",76,396
"990","  The same goes for the inflow of capital. Because a lot of what is going to be earned here will go elsewhere, if we take the third world, back home. 75 percent of Bosnians built the houses back home once they earned their money here. So there is a shortfall. The only expanses they had were for their, the employer, who has a burden. But you can't make an omelette without breaking some eggs.","Immigration",75,396
"991"," Well, my nan, shes worked all her life and shes bored, so shes just always going to bingo and wasting money really, just to get out and do something.  Whereas, my other nan, shes lazy, she doesnt want to do anything, she wants everyone running around.  Theyre both around the same age, so I think it just depends on the person themselves, thats why I think it should be their decision.","Generations",72,396
"992"," Many of them during the three years of childrearing leave could support use of home offices and deal with it this way. There are many professions where women work from home during those three years of child care. We have the technical capabilities in many cases to network people so they can do this, not on site, but that they can freely and flexibly arrange their workday from a home office.","Gender",72,397
"993","No, no. I have a female friend who works for a company which has 3 employees. It's illegal to ask a woman if she's pregnant. But he asked her: ""Are you pregnant? Do you have a boyfriend?"" His reason for asking that is of course that he doesn't have a very large profit margin. He couldn't afford for her to take maternity leave. Of course it's immoral to ask these questions, but I understand him.","Gender",68,397
"994"," They dropped out for this reason. I was talking with one of them recently, and she says that she has no job training, but its good that my children have a young mother. But if the child cant do anything, because she has no education, how is she going to teach the child anything, and how is it going to be paid for? So Id say its better when you have an education and qualifications first.","Generations",77,397
"995","Yes, that's true of course. One example is the US where there are 20 different ways to get a Green Card for anywhere between six months to six years, to do all sorts of things. In order to get permanent residency you need to either be invited or have an employer that's willing to hire you and they have to prove that you provide a service which they can't get from someone who's already a citizen.","Immigration",76,398
"996","  I'll say that they're okay, as long as they don't go overboard. When they reach about 50 %, they should be left alone with the hope that they will stay that way in the future. It's not good to have constant supervision over it, because the crucial is for the most competent candidate to be selected. But as long as there will be 5 or 10 % representation of women, it's a good idea to somehow ","Gender",78,398
"997"," But you're not gonna get that if you're not...I think that actually you can go just as far as somebody who's been to university, if you've got common sense.  You can go to university, but not know how to boil an egg.  So I think it doesn't...I don't think you...if somebody is not academic, they're not gonna learn more from staying at school.  In fact, they'll probably disrupt everybody else.","Labour market",71,398
"998"," I think a measure to deal with this is to try and monitor the teachers, because we had one who would just give away good grades, maybe because this person was about to retire, and they just didnt care. But the students dont get anything out of that. A good grade is nice on your report card, but in the end, we didnt learn anything in that class. They need to monitor and control such things.","Econ. Inequality",77,399
"999"," Well we are on about the cost as well isn't it, that you read on what's on page 14 it says it's says it's roughly thought between <a3>110 million to <a3>280 million a year we spend, right.    Then it says it's altogether normal use of the NHS by Foreign Ministers who have ended up being treated while in England is estimated to cost <a3>1.8 billion a year, <a3>138 billion  that's just outrageous isn't it.","Immigration",76,400
"1000","I know people, and I don't agree with their way of thinking, but there are many who would like to work off the books and still get early retirement. It's easy. My uncle is a psychiatrist. He says that there are many who come here who claim to suffer from post-traumatic stress too. And it's easy to get that diagnosis because the psychiatrists cannot disprove it. There must be a change in attitudes.","Immigration",73,400
"1001","There's no need to throw the things that the generations before us have spent 100 years building up down the toilet. My mother is unskilled and my father is a blacksmith. I spent a long time at university and received plenty of support from home and all that, and that's been possible thanks to the welfare state. They wouldn't have had the money to send me to university if we had a US-style system.","Generations",74,400
"1002","I want labour to be as cheap as possible so that we can produce as much as possible. And in that sense the youngest are the cheapest and the most effective. In the US they hire older people because they're very valuable when it comes to providing customer service. There must be a change in employers' attitudes to get them to start making use of these golden oldies, because they're actually golden.","Generations",72,400
"1003","  Earlier we were talking about how there used to be company scholarships, and that refers to this issue as well. Young people used to come to the company, learn from older employees, who then, hypothetically speaking, went into retirement in 5 years' time, and the newly arrived took over the knowledge, joined two stories and, what now? Now the problem is that there are no company scholarships.","Generations",68,400
"1004"," Also they all have to be registered, otherwise you dont know if there are school-aged children who are obligated to go to school, how old they arefrom the perspective of the authorities, there needs to be a quick and efficient system for registration, otherwise well have 30% who are not registered at all, we dont know where theyre from or what they need. Its a major problem at the moment.","Immigration",71,401
"1005"," The benefits is for them to teach younger people from what they know, I mean, you can always learn from an older person, and it stimulates their mindtheyre not going to be so, you know, theyre going to get .  The benefit is theyre contributing to society, theyre helping, its only four hours a week, its only paying them to do four hours a week, but its a contribution.","Generations",71,401
"1006"," Is it really the case that theyre better paid? If you are going to do the Abitur, a public school might be better than a school where it might be better, but youre not really qualified to be there, but your parents could afford it. Its just like with university studies. If you only get into some art school, because your parents paid a certain fee, even though you may actually have no talent.","Generations",75,401
"1007","  And then they work until very old age and if this would  and they are afraid of getting retired. I think as a rule people are afraid of going into retirement, because first of all, it is the final stage before (laughs),no offence, but it is, it is a life event, when one says, particularly because it is not followed by another two points, and every body thinks, this is it, I'm retired now and","Generations",77,401
"1008"," I don't think it should be called gender, I think it should be called whatever job you do.  I mean, the  be a dustbin man, it should be down to","Gender",80,402
"1009","But it's still a childcare guarantee. Isn't the most important thing that the municipality guarantees a childcare space, even if it's not around the corner from you. People need to be reasonable too. It's one thing that you say that it's within the municipality's borders, but if it's say 300 meters to the nursery, is that then too far? Where do you draw the line and say that the guarantee isn't met?","Gender",72,402
"1010"," Background leads to a different status over the short or long term, but performance based means that for the same work  if someone works less, then they should get paid less, even if they have the same job position. One works a lot and very effectively, then that person should get paid more than the other person. How that distinction is made is up to the individual firm as an internal decision.","Labour market",74,402
"1011","  And also, there is not just the Slovenian market, sole proprietors only see Slovenia as their market. They must get to know foreign markets, it is a huge market and I don't know, perhaps an agency or institute could be overseeing what kinds of things are sought after on the external markets. And then it would be easier to make decisions about what to produce, what sort of activity to undertake.","Labour market",72,402
"1012"," People who are doing the groundwork should get decent wages.  Not the person in the high chair at the top of the building.  I never see the gaffer  and the person who is doing the dirty work down there, the garbage man hes very important but who wants the garbage mans job.  The cleaner, nobody wants a cleaning job to clean toilets.","Econ. Inequality",73,403
"1013"," I have defined immigrants as refugees, not foreign workers from Sweden and Eastern Europe. We dont have the room or the economy for everyone who wants to come here. A measure I think can be good is that we give welfare goods after a while as employed, or that you have to get a job within a time span or you risk being deported. Integration, that language course, but we talked about that last time.","Immigration",76,403
"1014"," I think, you know, I work in education, I think, to an extent, a lot of people have this view that it is really totally unequal, but I think it ultimately comes back to what we were talking in there about.  Now, this isnt obviously a blanket across the board, its general, but people entering education have views about education, and that is down to the family and the way theyve been brought up.","Econ. Inequality",75,404
"1015"," We also identified that over the longer term, well have a shortage of workers, and in order to counteract this, and because we have these so-called high-potentials in countries like Spain who are well educated but cant find work there, we could consider setting up a system that eases this process of bringing people from other countries here and quickly helping them find the opportunity for work.","Immigration",68,404
"1016"," So, perhaps more monitoring of where, how the pension is monitored, what, you know, who looks after it.  Well, I don't know where the money goes, that you pay to a pension, I don't know where they keep it. So perhaps the government ought to explain things a little bit more in detail to us about...because we don't know.  I mean, does anybody know where the money goes when you pay into your pension?","Generations",75,404
"1017","If we're going to change the narrative a bit then I think that we should stop calling it the burden of an aging population. We use that phrase again and again and it's a negatively charged. We have people who have lived a long time who either have potential or they don't but they're not a burden. Our brains think about older people in negative terms and we shouldn't, so we should drop that expression.","Generations",75,404
"1018"," We put something on the list, gender and youth amongst other things. I want to focus on sending a signal not to stop doing whats working when it comes to gender equality in the labour market, when it comes to maternity leave, nursery schools, focus on education and skills development for these groups even if they are not mentioned. These are mechanisms that work quite well in our welfare society.","Labour market",71,404
"1019"," Because thats the main reason is that, you know, biologically the woman carries the baby for nine months and has that bond with them and actually its natural that they want to stay home probably longer than the men. Now most women will spend more time at home than the statutory maternity pay, so if there were potentially more opportunities for childcare because its bloody expensive, I know that","Gender",70,405
"1020","About the father's right to parental leave: companies should enter into agreement with the unions to establish that men can take paid paternity leave. Many still offer just a few weeks paid leave and a few months for the mother. There should be a fixed agreement on taking parental leave as a private sector employee, just like in the public sector. It shouldn't be up to companies to decide, but fixed...","Gender",71,405
"1021"," My sister's got a girl now that's 15, that's starting with, that wants to be a hairdresser, and she's not academic.  So the school are releasing her two days a week, so she's still doing her maths and her English GCSEs, and the basic sciences. But she's doing two days hairdressing. And then as soon as she's old enough to leave school, she will start on her course with the college, with day release.","Labour market",75,405
"1022"," You know, you could have a lot more ordinary jobs. Because not everybody has been to university, not everybody is clever.  Not everybody has the talent to pass their 11 Plus, or to do A levels and that, but they want to work.  But they haven't got those qualifications. But they want to work, and earn some money.  So you've got to have ordinary jobs in the market for them to do, to be trained to do.","Labour market",78,405
"1023","  But let's say, okay, I'd like to say this: those, you earlier said that educated people do not need to be taught how to write a job application. But those that aren't educated don't even know how to sit down behind a computer and nothing, while we all know that we are transiting into the era of all applications being in digital form. But this latter group needs to be taught how to apply for a job.","Labour market",78,405
"1024"," And more adapted. I think about the families who arrive. The father comes here to work, then he gets his family from his country. The women of the sits at home and the children go to school. Often those who sit at home are well educated. If only one person earns money, it is difficult to cover extra expenses like a Norwegian course. And an extra resource sits at home, really, instead of making money.","Immigration",76,406
"1025","  I would say that it should be encouraged for those occupations, which are in shortage here, physicians for example, I don't know, as well as for those who are bringing in the capital, to encourage a business, their business. That means not for those who are going to come here and go straight to the Employment agency, but those who bring their own ideas, how to for example start a business and so on.","Immigration",75,407
"1026","  And the sole proprietors also could not profit from working illegally. Because they now work illegally in order not to have to pay for child day care, so that they don't have to do those things and they receive instead the soci, there would be none of that anymore. They would receive the 500 EURO, whether they would be working or not, end of story. It would be better if they would work, wouldn't it.","Econ. Inequality",76,408
"1027"," But is the cash benefit really that bad? You can get it until two years old? I dont think it should be removed. That those who want the freedom can have it. Those who arent immigrants. That one is to take that opportunity away, to be home until the child is two years with the cash benefit. I dont think its right to take it away when it is only until two years. Optional for Norwegian families, then.","Immigration",79,408
"1028"," And work should play a role. It cant be that they worked 40 years and then they have nothing to live on the last three years of their life. You have to have a pension that is relative to the pay-in time period. Someone who worked for 40 years must be appreciated for their work, maybe a subordinate pension that is added to the basic pension, a kind of bonus for every year to reflect the pay-in period.","Generations",79,408
"1029"," If not sooner, at least by then. That will generate jobs related to where it should be built, where it should be located. We will be more people by then and we have to increase production and extend the agriculture. We need less consume, cleaner consume, less use of poison and stuff. That is very good. Then we have room for them too and spread the population throughout the country. Food where you are.","Labour market",75,408
"1030","  And these, these 2 groups of population are without vision, I mean, if we put what has been said before aside, they are endangered. But if a vision is to be introduced, if we were to add the element, which is known as, excuse me if it sounds creepy, oriented education or whatever, then no, there is almost no one who would be at the losing end of this measure. Which is sort of difficult to understand.","Labour market",78,408
"1031","  Eeh, do you know what the thing is about prices in shopping windows in America? No tax. Then you go inside and buy the item for the shopping window price plus the tax, and then you think, uh-huh, that's why it's so pricey. Look, employers pay everything, night shift work, this and that. And that's what they want to know. Not what goes where. But how much they are going to have to part with. That's it.","Econ. Inequality",78,409
"1032"," I think that in the end we forget the human aspect. Money isnt what matters. Lets say the father was alone with the children for a whole year, how would that make the mother feel? Is that lunatic supposed to look after my children for three weeks? Right. Maybe I sound old-fashioned, but the father doesnt have that mothers instinct. It changes you. I dont think it has to do with money in the end.","Gender",76,409
"1033","  We keep on repeating that pay checks are over burdened with these contributions and everything. So where does this money go to? It should be made clear once and for all: This is how much money there is, this is how much goes for the pensions, and this is how much for social transfers. We keep on turning around in circles, why should we be paying more? We need to have a system in place, in order to  .","Generations",81,409
"1034"," What we talked about earlier about apprentices and stuff like that, if you, if somebody said to you I want an apprentice - well I'm in childcare, want an apprentice nursery nurse but we are going to pay <a3>3.30 an hour.     If you turned around and said we are going to pay <a3>6 an hour while you train, you are thinking hold on a minute, that's already more appealing and get more funding for apprenticeships.","Immigration",76,410
"1035"," Right, I would like to emphasize this, because I see this problem with my daughter. She can do home office if she likes, but her partner had never thought to do something like this unless the employer had mentioned it. Id said last time that home office cant be the solution. You need a social environment, colleagues and so forth, and not trying to clean diapers on the side and cooking for the husband.","Gender",75,410
"1036","  Quality is a risk. The quality of programmes being carried out is a risk. Thats for sure. Because, you know, people need to be trained. Because if the employees from the public sector switched to the private sector, the ones that are already trained, educated, that would be OK. Otherwise, you know, if the programme isnt correct, and carrying it out, education, small children, thats also not correct.","Gender",69,410
"1037","  about the flexible route if were going to be doing it, because obviously, well, in my opinion, if someone is 80 years old they arent going to want to do full time, or theyd be incapable of doing it.  But, if you want to do four hours one day a week, do you know what I mean, theyve got something to look forward to, something to stimulate their mind and make them feel more worthy.","Generations",78,410
"1038"," This is linked though, isnt it? Its all linked. If we get rid of all the immigrants  and things like that, then we arent going to have this issue, are we, so its all linked together, and then we can start saying to people you can retire at 65 because weve got enough money. Were paying for the down and outs who dont want to work and things like that, its just a complete mess.","Generations",78,410
"1039"," And you have this public official status, the difference between A and B and the salary levels, there is an inequality there, certainly, but in the private sector its even more pronounced. I think the same pay for the same work is more to do with performance. Every person works differently, and the person who works better and more effectively should earn more in my view. Its capitalism, not socialism.","Labour market",71,410
"1040"," Its about tailoring peoples experience of education to the actual individual, rather than having a generic, you can do this, that, and the other, but youve got to do a set of one, two, three.  In my school there was only one qualification I could have done in manual labour, for want of a better phrase.  So, its about recognising, for me, outside of that academic, economics and all that sort of stuff.","Econ. Inequality",74,411
"1041"," More tax on for example return, then? If you have assets it doesnt directly go under income. If that is the disparity we should even out, though. Because inheritance itself is a one-time matter, or perhaps a hole saying something else. Many people make money of the return from assets. Regarding wage inequality, maybe it is more realistic to make adjustments in the return you get from the assets you have.","Econ. Inequality",72,411
"1042","I'm in favour of mandatory paternity leave for a number of reasons. Partly because the woman is a great deal worse off in term of her pension if she has to take all the parental leave and partly because there's value in men getting a basic insights into caring for their own children. That benefits both society and the child. I think that we should look to the Swedish model, which I cannot remember in detail.","Gender",76,411
"1043"," We also have to figure out how to pay for it. This is important. We cant always have a pyramid where the younger people is the majority, because that means we are becoming more and more people in the world. Have to find solutions for how to keep the population relatively stable concerning age and still keep the economy going. Then the pension could be Even though I completely agree with you that elder","Generations",75,411
"1044","  Yes, we are on a very drafty place here, there is no more growth among generations in the traditional sense, where there would be a transfer of knowledge and transfer of values like there used to be. How should I put it, these values and the family system were being transferred. I think it is completely different in the modern digital age. It calls for a re-thinking, I don't know what sort of a measure.","Generations",76,411
